Nr;Titel;Jahr;Regissure;Hauptdarsteller;IMDB-Top 250;IMDb-Charts;Studio;Genre;Einspielergebnise;Zuschauerzahlen;YT-Link;App-Link;App-Link_Video-1;App-Link_Video-2;App-Link_Video-3;QR-Cod Pfad;;;;;;
001;Avatar;2009;James Cameron;Sam Worthington, Zoe Saldaña, Sigourney Weaver, Stephen Lang, Michelle Rodriguez;Nein;7,9;Dune Entertainment;Action, Abenteuer, Fantasy, Science Fiction;$2,923,706,026;;https://www.youtube.com/watch?v=5PSNL1qE6VY;filmster://result?id=001;https://filmster-stream.b-cdn.net/videos/Filmster_001_Video-1.mp4;https://filmster-stream.b-cdn.net/videos/Filmster_001_Video-2.mp4;https://filmster-stream.b-cdn.net/videos/Filmster_001_Video-3.mp4;qr_codes/Filmster_001_QR.png;;;;;;
002;Titanic;1997;James Cameron;Leonardo DiCaprio, Kate Winslet, Billy Zane, Kathy Bates, Frances Fisher;Nein;7,9;Paramount Pictures;Drama, Liebesfilm;$2,264,162,353;;https://www.youtube.com/watch?v=CHekzSiZjrY;filmster://result?id=002;https://filmster-stream.b-cdn.net/videos/Filmster_002_Video-1.mp4;https://filmster-stream.b-cdn.net/videos/Filmster_002_Video-2.mp4;https://filmster-stream.b-cdn.net/videos/Filmster_002_Video-3.mp4;qr_codes/Filmster_002_QR.png;;;;;;
003;Avengers: Endgame;2019;Anthony Russo;Robert Downey Jr., Chris Evans, Mark Ruffalo, Chris Hemsworth, Scarlett Johansson;Ja;8,4;Marvel Studios;Abenteuer, Science Fiction, Action;$2,799,439,100;;https://www.youtube.com/watch?v=TcMBFSGVi1c;filmster://result?id=003;https://filmster-stream.b-cdn.net/videos/Filmster_003_Video-1.mp4;https://filmster-stream.b-cdn.net/videos/Filmster_003_Video-2.mp4;https://filmster-stream.b-cdn.net/videos/Filmster_003_Video-3.mp4;qr_codes/Filmster_003_QR.png;;;;;;
004;Star Wars: Episode VII , The Force Awakens;2015;J.J. Abrams;Harrison Ford, Mark Hamill, Carrie Fisher, Adam Driver, Daisy Ridley;Nein;7,8;Lucasfilm Ltd.;Abenteuer, Action, Science Fiction;$2,068,223,624;;https://www.youtube.com/watch?v=sGbxmsDFVnE;filmster://result?id=004;https://filmster-stream.b-cdn.net/videos/Filmster_004_Video-1.mp4;https://filmster-stream.b-cdn.net/videos/Filmster_004_Video-2.mp4;https://filmster-stream.b-cdn.net/videos/Filmster_004_Video-3.mp4;qr_codes/Filmster_004_QR.png;;;;;;
005;Jurassic Park;1993;Steven Spielberg;Sam Neill, Laura Dern, Jeff Goldblum, Richard Attenborough, Bob Peck;Ja;8,2;Universal Pictures;Abenteuer, Science Fiction;$920,100,000;;https://www.youtube.com/watch?v=QWBKEmWWL38;filmster://result?id=005;https://filmster-stream.b-cdn.net/videos/Filmster_005_Video-1.mp4;https://filmster-stream.b-cdn.net/videos/Filmster_005_Video-2.mp4;https://filmster-stream.b-cdn.net/videos/Filmster_005_Video-3.mp4;qr_codes/Filmster_005_QR.png;;;;;;
006;The Lion King;1994;Roger Allers;Matthew Broderick, Moira Kelly, Nathan Lane, Ernie Sabella, James Earl Jones;Ja;8,5;Walt Disney Pictures;Familie, Animation, Drama;$763,455,561;;https://www.youtube.com/watch?v=lFzVJEksoDY;filmster://result?id=006;https://filmster-stream.b-cdn.net/videos/Filmster_006_Video-1.mp4;https://filmster-stream.b-cdn.net/videos/Filmster_006_Video-2.mp4;https://filmster-stream.b-cdn.net/videos/Filmster_006_Video-3.mp4;qr_codes/Filmster_006_QR.png;;;;;;
007;Harry Potter and the Sorcerer's Stone;2001;Chris Columbus;Daniel Radcliffe, Rupert Grint, Emma Watson, Richard Harris, Tom Felton;Nein;7,7;Warner Bros. Pictures;Abenteuer, Fantasy;$976,475,550;;https://www.youtube.com/watch?v=VyHV0BRtdxo;filmster://result?id=007;https://filmster-stream.b-cdn.net/videos/Filmster_007_Video-1.mp4;https://filmster-stream.b-cdn.net/videos/Filmster_007_Video-2.mp4;https://filmster-stream.b-cdn.net/videos/Filmster_007_Video-3.mp4;qr_codes/Filmster_007_QR.png;;;;;;
008;The Lord of the Rings: The Return of the King;2003;Peter Jackson;Elijah Wood, Ian McKellen, Viggo Mortensen, Sean Astin, Andy Serkis;Ja;9;New Line Cinema;Abenteuer, Fantasy, Action;$1,118,888,979;;https://www.youtube.com/watch?v=r5X-hFf6Bwo;filmster://result?id=008;https://filmster-stream.b-cdn.net/videos/Filmster_008_Video-1.mp4;https://filmster-stream.b-cdn.net/videos/Filmster_008_Video-2.mp4;https://filmster-stream.b-cdn.net/videos/Filmster_008_Video-3.mp4;qr_codes/Filmster_008_QR.png;;;;;;
009;Frozen;2013;Chris Buck;Idina Menzel, Kristen Bell, Jonathan Groff, Josh Gad, Livvy Stubenrauch;Nein;7,4;Walt Disney Pictures;Animation, Familie, Abenteuer, Fantasy;$1,274,219,009;;https://www.youtube.com/watch?v=TbQm5doF_Uc;filmster://result?id=009;https://filmster-stream.b-cdn.net/videos/Filmster_009_Video-1.mp4;https://filmster-stream.b-cdn.net/videos/Filmster_009_Video-2.mp4;https://filmster-stream.b-cdn.net/videos/Filmster_009_Video-3.mp4;qr_codes/Filmster_009_QR.png;;;;;;
010;E.T. the Extra-Terrestrial;1982;Steven Spielberg;Henry Thomas, Drew Barrymore, Robert MacNaughton, Peter Coyote, Dee Wallace;Nein;7,9;Universal Pictures;Science Fiction, Abenteuer, Familie, Fantasy;$792,965,500;;https://www.youtube.com/watch?v=qYAETtIIClk;filmster://result?id=010;https://filmster-stream.b-cdn.net/videos/Filmster_010_Video-1.mp4;https://filmster-stream.b-cdn.net/videos/Filmster_010_Video-2.mp4;https://filmster-stream.b-cdn.net/videos/Filmster_010_Video-3.mp4;qr_codes/Filmster_010_QR.png;;;;;;
011;Spider-Man: No Way Home;2021;Jon Watts;Tom Holland, Zendaya, Benedict Cumberbatch, Jacob Batalon, Jon Favreau;Ja;8,2;Marvel Studios;Action, Abenteuer, Science Fiction;$1,921,847,111;;https://www.youtube.com/watch?v=JfVOs4VSpmA;filmster://result?id=011;https://filmster-stream.b-cdn.net/videos/Filmster_011_Video-1.mp4;https://filmster-stream.b-cdn.net/videos/Filmster_011_Video-2.mp4;https://filmster-stream.b-cdn.net/videos/Filmster_011_Video-3.mp4;qr_codes/Filmster_011_QR.png;;;;;;
012;The Dark Knight;2008;Christopher Nolan;Christian Bale, Heath Ledger, Aaron Eckhart, Michael Caine, Maggie Gyllenhaal;Ja;9;Warner Bros. Pictures;Drama, Action, Krimi, Thriller;$1,004,558,444;;https://www.youtube.com/watch?v=EXeTwQWrcwY;filmster://result?id=012;https://filmster-stream.b-cdn.net/videos/Filmster_012_Video-1.mp4;https://filmster-stream.b-cdn.net/videos/Filmster_012_Video-2.mp4;https://filmster-stream.b-cdn.net/videos/Filmster_012_Video-3.mp4;qr_codes/Filmster_012_QR.png;;;;;;
013;Independence Day;1996;Roland Emmerich;Will Smith, Bill Pullman, Jeff Goldblum, Mary McDonnell, Judd Hirsch;Nein;7;20th Century Fox;Action, Abenteuer, Science Fiction;$817,400,891;;https://www.youtube.com/watch?v=B1E7h3SeMDk;filmster://result?id=013;https://filmster-stream.b-cdn.net/videos/Filmster_013_Video-1.mp4;https://filmster-stream.b-cdn.net/videos/Filmster_013_Video-2.mp4;https://filmster-stream.b-cdn.net/videos/Filmster_013_Video-3.mp4;qr_codes/Filmster_013_QR.png;;;;;;
014;Inception;2010;Christopher Nolan;Leonardo DiCaprio, Joseph Gordon-Levitt, Ken Watanabe, Tom Hardy, Elliot Page;Ja;8,8;Legendary Pictures;Action, Science Fiction, Abenteuer;$839,030,630;;https://www.youtube.com/watch?v=YoHD9XEInc0;filmster://result?id=014;https://filmster-stream.b-cdn.net/videos/Filmster_014_Video-1.mp4;https://filmster-stream.b-cdn.net/videos/Filmster_014_Video-2.mp4;https://filmster-stream.b-cdn.net/videos/Filmster_014_Video-3.mp4;qr_codes/Filmster_014_QR.png;;;;;;
015;Finding Nemo;2003;Andrew Stanton;Albert Brooks, Ellen DeGeneres, Alexander Gould, Willem Dafoe, Geoffrey Rush;Ja;8,2;Pixar;Animation, Familie;$940,335,536;;https://www.youtube.com/watch?v=9oQ628Seb9w;filmster://result?id=015;https://filmster-stream.b-cdn.net/videos/Filmster_015_Video-1.mp4;https://filmster-stream.b-cdn.net/videos/Filmster_015_Video-2.mp4;https://filmster-stream.b-cdn.net/videos/Filmster_015_Video-3.mp4;qr_codes/Filmster_015_QR.png;;;;;;
016;Star Wars: Episode I , The Phantom Menace;1999;George Lucas;Liam Neeson, Ewan McGregor, Natalie Portman, Jake Lloyd, Ian McDiarmid;Nein;6,5;Lucasfilm Ltd.;Abenteuer, Action, Science Fiction;$924,317,558;;https://www.youtube.com/watch?v=bD7bpG-zDJQ;filmster://result?id=016;https://filmster-stream.b-cdn.net/videos/Filmster_016_Video-1.mp4;https://filmster-stream.b-cdn.net/videos/Filmster_016_Video-2.mp4;https://filmster-stream.b-cdn.net/videos/Filmster_016_Video-3.mp4;qr_codes/Filmster_016_QR.png;;;;;;
017;The Matrix;1999;Lana Wachowski;Keanu Reeves, Laurence Fishburne, Carrie-Anne Moss, Hugo Weaving, Gloria Foster;Ja;8,7;Village Roadshow Pictures;Action, Science Fiction;$463,517,383;;https://www.youtube.com/watch?v=vKQi3bBA1y8;filmster://result?id=017;https://filmster-stream.b-cdn.net/videos/Filmster_017_Video-1.mp4;https://filmster-stream.b-cdn.net/videos/Filmster_017_Video-2.mp4;https://filmster-stream.b-cdn.net/videos/Filmster_017_Video-3.mp4;qr_codes/Filmster_017_QR.png;;;;;;
018;Forrest Gump;1994;Robert Zemeckis;Tom Hanks, Robin Wright, Gary Sinise, Sally Field, Mykelti Williamson;Ja;8,8;Paramount Pictures;Komedie, Drama, Liebesfilm;$677,387,716;;https://www.youtube.com/watch?v=XHhAG-YLdk8;filmster://result?id=018;https://filmster-stream.b-cdn.net/videos/Filmster_018_Video-1.mp4;https://filmster-stream.b-cdn.net/videos/Filmster_018_Video-2.mp4;https://filmster-stream.b-cdn.net/videos/Filmster_018_Video-3.mp4;qr_codes/Filmster_018_QR.png;;;;;;
019;The Hunger Games;2012;Gary Ross;Jennifer Lawrence, Josh Hutcherson, Liam Hemsworth, Woody Harrelson, Elizabeth Banks;Nein;7,2;Lionsgate;Science Fiction, Abenteuer, Action;$694,394,724;;https://www.youtube.com/watch?v=mfmrPu43DF8;filmster://result?id=019;https://filmster-stream.b-cdn.net/videos/Filmster_019_Video-1.mp4;https://filmster-stream.b-cdn.net/videos/Filmster_019_Video-2.mp4;https://filmster-stream.b-cdn.net/videos/Filmster_019_Video-3.mp4;qr_codes/Filmster_019_QR.png;;;;;;
020;Top Gun: Maverick;2022;Joseph Kosinski;Tom Cruise, Val Kilmer, Miles Teller, Jennifer Connelly, Bashir Salahuddin;Ja;8,2;Skydance Media;Action, Drama;$1,488,732,821;;https://www.youtube.com/watch?v=giXco2jaZ_4;filmster://result?id=020;https://filmster-stream.b-cdn.net/videos/Filmster_020_Video-1.mp4;https://filmster-stream.b-cdn.net/videos/Filmster_020_Video-2.mp4;https://filmster-stream.b-cdn.net/videos/Filmster_020_Video-3.mp4;qr_codes/Filmster_020_QR.png;;;;;;
021;Beauty and the Beast;1991;Gary Trousdale;Paige O'Hara, Robby Benson, Richard White, Jerry Orbach, David Ogden Stiers;Ja;8;Walt Disney Pictures;Liebesfilm, Familie, Animation, Fantasy;$424,967,620;;https://www.youtube.com/watch?v=iurbZwxKFUE;filmster://result?id=021;https://filmster-stream.b-cdn.net/videos/Filmster_021_Video-1.mp4;https://filmster-stream.b-cdn.net/videos/Filmster_021_Video-2.mp4;https://filmster-stream.b-cdn.net/videos/Filmster_021_Video-3.mp4;qr_codes/Filmster_021_QR.png;;;;;;
022;Minions;2015;Kyle Balda;Sandra Bullock, Jon Hamm, Michael Keaton, Allison Janney, Steve Coogan;Nein;6,4;Illumination;Familie, Animation, Abenteuer, Komedie;$1,159,457,503;;https://www.youtube.com/watch?v=eisKxhjBnZ0;filmster://result?id=022;https://filmster-stream.b-cdn.net/videos/Filmster_022_Video-1.mp4;https://filmster-stream.b-cdn.net/videos/Filmster_022_Video-2.mp4;https://filmster-stream.b-cdn.net/videos/Filmster_022_Video-3.mp4;qr_codes/Filmster_022_QR.png;;;;;;
023;Toy Story 3;2010;Lee Unkrich;Tom Hanks, Tim Allen, Joan Cusack, Don Rickles, Wallace Shawn;Ja;8,3;Pixar;Animation, Familie, Komedie;$1,067,316,101;;https://www.youtube.com/watch?v=2BlMNH1QTeE;filmster://result?id=023;https://filmster-stream.b-cdn.net/videos/Filmster_023_Video-1.mp4;https://filmster-stream.b-cdn.net/videos/Filmster_023_Video-2.mp4;https://filmster-stream.b-cdn.net/videos/Filmster_023_Video-3.mp4;qr_codes/Filmster_023_QR.png;;;;;;
024;Pirates of the Caribbean: Dead Man's Chest;2006;Gore Verbinski;Johnny Depp, Orlando Bloom, Keira Knightley, Stellan Skarsgård, Bill Nighy;Nein;7,4;Walt Disney Pictures;Abenteuer, Fantasy, Action;$1,066,179,747;;https://www.youtube.com/watch?v=SNA-Ezahmok;filmster://result?id=024;https://filmster-stream.b-cdn.net/videos/Filmster_024_Video-1.mp4;https://filmster-stream.b-cdn.net/videos/Filmster_024_Video-2.mp4;https://filmster-stream.b-cdn.net/videos/Filmster_024_Video-3.mp4;qr_codes/Filmster_024_QR.png;;;;;;
025;Bohemian Rhapsody;2018;Bryan Singer;Rami Malek, Gwilym Lee, Ben Hardy, Joseph Mazzello, Lucy Boynton;Nein;7,9;20th Century Fox;Musik, Drama;$910,813,521;;https://www.youtube.com/watch?v=mP0VHJYFOAU;filmster://result?id=025;https://filmster-stream.b-cdn.net/videos/Filmster_025_Video-1.mp4;https://filmster-stream.b-cdn.net/videos/Filmster_025_Video-2.mp4;https://filmster-stream.b-cdn.net/videos/Filmster_025_Video-3.mp4;qr_codes/Filmster_025_QR.png;;;;;;
026;The Lord of the Rings: The Two Towers;2002;Peter Jackson;Elijah Wood, Ian McKellen, Viggo Mortensen, Sean Astin, Andy Serkis;Ja;8,8;New Line Cinema;Abenteuer, Fantasy, Action;$926,287,400;;https://www.youtube.com/watch?v=LbfMDwc4azU;filmster://result?id=026;https://filmster-stream.b-cdn.net/videos/Filmster_026_Video-1.mp4;https://filmster-stream.b-cdn.net/videos/Filmster_026_Video-2.mp4;https://filmster-stream.b-cdn.net/videos/Filmster_026_Video-3.mp4;qr_codes/Filmster_026_QR.png;;;;;;
027;Black Panther;2018;Ryan Coogler;Chadwick Boseman, Michael B. Jordan, Lupita Nyong'o, Danai Gurira, Martin Freeman;Nein;7,3;Marvel Studios;Action, Abenteuer, Science Fiction;$1,349,926,083;;https://www.youtube.com/watch?v=xjDjIWPwcPU;filmster://result?id=027;https://filmster-stream.b-cdn.net/videos/Filmster_027_Video-1.mp4;https://filmster-stream.b-cdn.net/videos/Filmster_027_Video-2.mp4;https://filmster-stream.b-cdn.net/videos/Filmster_027_Video-3.mp4;qr_codes/Filmster_027_QR.png;;;;;;
028;Frozen II;2019;Jennifer Lee;Idina Menzel, Kristen Bell, Josh Gad, Jonathan Groff, Evan Rachel Wood;Nein;6,8;Walt Disney Pictures;Familie, Animation, Abenteuer, Komedie, Fantasy;$1,453,683,476;;https://www.youtube.com/watch?v=Zi4LMpSDccc;filmster://result?id=028;https://filmster-stream.b-cdn.net/videos/Filmster_028_Video-1.mp4;https://filmster-stream.b-cdn.net/videos/Filmster_028_Video-2.mp4;https://filmster-stream.b-cdn.net/videos/Filmster_028_Video-3.mp4;qr_codes/Filmster_028_QR.png;;;;;;
029;The Lord of the Rings: The Fellowship of the Ring;2001;Peter Jackson;Elijah Wood, Ian McKellen, Viggo Mortensen, Sean Astin, Ian Holm;Ja;8,9;New Line Cinema;Abenteuer, Fantasy, Action;$871,368,364;;https://www.youtube.com/watch?v=V75dMMIW2B4;filmster://result?id=029;https://filmster-stream.b-cdn.net/videos/Filmster_029_Video-1.mp4;https://filmster-stream.b-cdn.net/videos/Filmster_029_Video-2.mp4;https://filmster-stream.b-cdn.net/videos/Filmster_029_Video-3.mp4;qr_codes/Filmster_029_QR.png;;;;;;
030;Star Wars: Episode III , Revenge of the Sith;2005;George Lucas;Hayden Christensen, Ewan McGregor, Natalie Portman, Ian McDiarmid, Samuel L. Jackson;Nein;7,6;Lucasfilm Ltd.;Abenteuer, Action, Science Fiction;$850,000,000;;https://www.youtube.com/watch?v=5UnjrG_N8hU;filmster://result?id=030;https://filmster-stream.b-cdn.net/videos/Filmster_030_Video-1.mp4;https://filmster-stream.b-cdn.net/videos/Filmster_030_Video-2.mp4;https://filmster-stream.b-cdn.net/videos/Filmster_030_Video-3.mp4;qr_codes/Filmster_030_QR.png;;;;;;
031;Despicable Me 2;2013;Chris Renaud;Steve Carell, Kristen Wiig, Benjamin Bratt, Miranda Cosgrove, Russell Brand;Nein;7,3;Illumination;Animation, Komedie, Familie;$970,766,005;;https://www.youtube.com/watch?v=TlbnGSMJQbQ;filmster://result?id=031;https://filmster-stream.b-cdn.net/videos/Filmster_031_Video-1.mp4;https://filmster-stream.b-cdn.net/videos/Filmster_031_Video-2.mp4;https://filmster-stream.b-cdn.net/videos/Filmster_031_Video-3.mp4;qr_codes/Filmster_031_QR.png;;;;;;
032;The Avengers;2012;Joss Whedon;Robert Downey Jr., Chris Evans, Mark Ruffalo, Chris Hemsworth, Scarlett Johansson;Ja;8;Marvel Studios;Science Fiction, Action, Abenteuer;$1,518,815,515;;https://www.youtube.com/watch?v=eOrNdBpGMv8;filmster://result?id=032;https://filmster-stream.b-cdn.net/videos/Filmster_032_Video-1.mp4;https://filmster-stream.b-cdn.net/videos/Filmster_032_Video-2.mp4;https://filmster-stream.b-cdn.net/videos/Filmster_032_Video-3.mp4;qr_codes/Filmster_032_QR.png;;;;;;
033;The Incredibles;2004;Brad Bird;Craig T. Nelson, Holly Hunter, Sarah Vowell, Spencer Fox, Jason Lee;Ja;8;Walt Disney Pictures;Action, Abenteuer, Animation, Familie;$631,442,092;;https://www.youtube.com/watch?v=-UaGUdNJdRQ;filmster://result?id=033;https://filmster-stream.b-cdn.net/videos/Filmster_033_Video-1.mp4;https://filmster-stream.b-cdn.net/videos/Filmster_033_Video-2.mp4;https://filmster-stream.b-cdn.net/videos/Filmster_033_Video-3.mp4;qr_codes/Filmster_033_QR.png;;;;;;
034;The Fate of the Furious;2017;F. Gary Gray;Vin Diesel, Jason Statham, Dwayne Johnson, Michelle Rodriguez, Tyrese Gibson;Nein;6,6;Original Film;Action, Krimi, Thriller;$1,236,000,000;;https://www.youtube.com/watch?v=JwMKRevYa_M;filmster://result?id=034;https://filmster-stream.b-cdn.net/videos/Filmster_034_Video-1.mp4;https://filmster-stream.b-cdn.net/videos/Filmster_034_Video-2.mp4;https://filmster-stream.b-cdn.net/videos/Filmster_034_Video-3.mp4;qr_codes/Filmster_034_QR.png;;;;;;
035;Shrek 2;2004;Conrad Vernon;Mike Myers, Eddie Murphy, Cameron Diaz, Julie Andrews, Antonio Banderas;Nein;7,4;DreamWorks Animation;Animation, Familie, Komedie, Fantasy, Abenteuer;$935,454,538;;https://www.youtube.com/watch?v=xBgSfhp5Fxo;filmster://result?id=035;https://filmster-stream.b-cdn.net/videos/Filmster_035_Video-1.mp4;https://filmster-stream.b-cdn.net/videos/Filmster_035_Video-2.mp4;https://filmster-stream.b-cdn.net/videos/Filmster_035_Video-3.mp4;qr_codes/Filmster_035_QR.png;;;;;;
036;Ice Age: Dawn of the Dinosaurs;2009;Carlos Saldanha;Ray Romano, John Leguizamo, Denis Leary, Queen Latifah, Simon Pegg;Nein;6,9;Blue Sky Studios;Animation, Komedie, Familie, Abenteuer;$886,686,817;;https://www.youtube.com/watch?v=MnAi5u-k9NY;filmster://result?id=036;https://filmster-stream.b-cdn.net/videos/Filmster_036_Video-1.mp4;https://filmster-stream.b-cdn.net/videos/Filmster_036_Video-2.mp4;https://filmster-stream.b-cdn.net/videos/Filmster_036_Video-3.mp4;qr_codes/Filmster_036_QR.png;;;;;;
037;Skyfall;2012;Sam Mendes;Daniel Craig, Judi Dench, Javier Bardem, Ralph Fiennes, Naomie Harris;Nein;7,8;Metro-Goldwyn-Mayer;Action, Abenteuer, Thriller;$1,108,594,176;;https://www.youtube.com/watch?v=6kw1UVovByw;filmster://result?id=037;https://filmster-stream.b-cdn.net/videos/Filmster_037_Video-1.mp4;https://filmster-stream.b-cdn.net/videos/Filmster_037_Video-2.mp4;https://filmster-stream.b-cdn.net/videos/Filmster_037_Video-3.mp4;qr_codes/Filmster_037_QR.png;;;;;;
038;Spectre;2015;Sam Mendes;Daniel Craig, Christoph Waltz, Léa Seydoux, Ralph Fiennes, Monica Bellucci;Nein;6,8;Metro-Goldwyn-Mayer;Action, Abenteuer, Thriller;$880,707,597;;https://www.youtube.com/watch?v=ujmoYyEyDP8;filmster://result?id=038;https://filmster-stream.b-cdn.net/videos/Filmster_038_Video-1.mp4;https://filmster-stream.b-cdn.net/videos/Filmster_038_Video-2.mp4;https://filmster-stream.b-cdn.net/videos/Filmster_038_Video-3.mp4;qr_codes/Filmster_038_QR.png;;;;;;
039;Inside Out;2015;Pete Docter;Amy Poehler, Phyllis Smith, Richard Kind, Bill Hader, Lewis Black;Ja;8,1;Pixar;Animation, Familie, Abenteuer, Drama, Komedie;$857,611,174;;https://www.youtube.com/watch?v=yRUAzGQ3nSY;filmster://result?id=039;https://filmster-stream.b-cdn.net/videos/Filmster_039_Video-1.mp4;https://filmster-stream.b-cdn.net/videos/Filmster_039_Video-2.mp4;https://filmster-stream.b-cdn.net/videos/Filmster_039_Video-3.mp4;qr_codes/Filmster_039_QR.png;;;;;;
040;Zootopia;2016;Byron Howard;Ginnifer Goodwin, Jason Bateman, Idris Elba, Jenny Slate, Nate Torrence;Ja;8;Walt Disney Animation Studios;Animation, Abenteuer, Familie, Komedie;$1,023,784,195;;https://www.youtube.com/watch?v=jWM0ct-OLsM;filmster://result?id=040;https://filmster-stream.b-cdn.net/videos/Filmster_040_Video-1.mp4;https://filmster-stream.b-cdn.net/videos/Filmster_040_Video-2.mp4;https://filmster-stream.b-cdn.net/videos/Filmster_040_Video-3.mp4;qr_codes/Filmster_040_QR.png;;;;;;
041;The Secret Life of Pets;2016;Chris Renaud;Louis C.K., Eric Stonestreet, Kevin Hart, Jenny Slate, Ellie Kemper;Nein;6,5;Illumination;Familie, Komedie, Abenteuer, Animation;$875,457,937;;https://www.youtube.com/watch?v=i-80SGWfEjM;filmster://result?id=041;https://filmster-stream.b-cdn.net/videos/Filmster_041_Video-1.mp4;https://filmster-stream.b-cdn.net/videos/Filmster_041_Video-2.mp4;https://filmster-stream.b-cdn.net/videos/Filmster_041_Video-3.mp4;qr_codes/Filmster_041_QR.png;;;;;;
042;Ice Age;2002;Chris Wedge;Ray Romano, John Leguizamo, Denis Leary, Goran Višnjić, Jack Black;Nein;7,5;Blue Sky Studios;Animation, Komedie, Familie, Abenteuer;$383,257,136;;https://www.youtube.com/watch?v=i4noiCRJRoE;filmster://result?id=042;https://filmster-stream.b-cdn.net/videos/Filmster_042_Video-1.mp4;https://filmster-stream.b-cdn.net/videos/Filmster_042_Video-2.mp4;https://filmster-stream.b-cdn.net/videos/Filmster_042_Video-3.mp4;qr_codes/Filmster_042_QR.png;;;;;;
043;Aladdin;2019;Guy Ritchie;Will Smith, Mena Massoud, Naomi Scott, Marwan Kenzari, Navid Negahban;Nein;6,9;Walt Disney Pictures;Abenteuer, Fantasy, Liebesfilm, Familie;$1,097,831,681;;https://www.youtube.com/watch?v=JcMtWwiyzpU;filmster://result?id=043;https://filmster-stream.b-cdn.net/videos/Filmster_043_Video-1.mp4;https://filmster-stream.b-cdn.net/videos/Filmster_043_Video-2.mp4;https://filmster-stream.b-cdn.net/videos/Filmster_043_Video-3.mp4;qr_codes/Filmster_043_QR.png;;;;;;
044;Moana;2016;John Musker;Auliʻi Cravalho, Dwayne Johnson, Rachel House, Temuera Morrison, Jemaine Clement;Nein;7,6;Walt Disney Pictures;Abenteuer, Komedie, Familie, Animation;$690,860,472;;https://www.youtube.com/watch?v=LKFuXETZUsI;filmster://result?id=044;https://filmster-stream.b-cdn.net/videos/Filmster_044_Video-1.mp4;https://filmster-stream.b-cdn.net/videos/Filmster_044_Video-2.mp4;https://filmster-stream.b-cdn.net/videos/Filmster_044_Video-3.mp4;qr_codes/Filmster_044_QR.png;;;;;;
045;Joker;2019;Todd Phillips;Joaquin Phoenix, Robert De Niro, Zazie Beetz, Frances Conroy, Brett Cullen;Ja;8,3;Warner Bros. Pictures;Krimi, Thriller, Drama;$1,078,958,629;;https://www.youtube.com/watch?v=zAGVQLHvwOY;filmster://result?id=045;https://filmster-stream.b-cdn.net/videos/Filmster_045_Video-1.mp4;https://filmster-stream.b-cdn.net/videos/Filmster_045_Video-2.mp4;https://filmster-stream.b-cdn.net/videos/Filmster_045_Video-3.mp4;qr_codes/Filmster_045_QR.png;;;;;;
046;Star Wars: The Rise of Skywalker;2019;J.J. Abrams;Carrie Fisher, Mark Hamill, Daisy Ridley, Adam Driver, John Boyega;Nein;;Lucasfilm Ltd.;Abenteuer, Action, Science Fiction;$1,074,144,248;;https://www.youtube.com/watch?v=8Qn_spdM5Zg;filmster://result?id=046;https://filmster-stream.b-cdn.net/videos/Filmster_046_Video-1.mp4;https://filmster-stream.b-cdn.net/videos/Filmster_046_Video-2.mp4;https://filmster-stream.b-cdn.net/videos/Filmster_046_Video-3.mp4;qr_codes/Filmster_046_QR.png;;;;;;
047;Up;2009;Pete Docter;Ed Asner, Christopher Plummer, Jordan Nagai, Bob Peterson, Delroy Lindo;Ja;8,3;Pixar;Animation, Komedie, Familie, Abenteuer;$735,099,082;;https://www.youtube.com/watch?v=HWEW_qTLSEE;filmster://result?id=047;https://filmster-stream.b-cdn.net/videos/Filmster_047_Video-1.mp4;https://filmster-stream.b-cdn.net/videos/Filmster_047_Video-2.mp4;https://filmster-stream.b-cdn.net/videos/Filmster_047_Video-3.mp4;qr_codes/Filmster_047_QR.png;;;;;;
048;Tangled;2010;Nathan Greno;Mandy Moore, Zachary Levi, Donna Murphy, Ron Perlman, M.C. Gainey;Nein;7,7;Walt Disney Animation Studios;Animation, Familie, Abenteuer;$592,461,732;;https://www.youtube.com/watch?v=gsYKF8ecC8g;filmster://result?id=048;https://filmster-stream.b-cdn.net/videos/Filmster_048_Video-1.mp4;https://filmster-stream.b-cdn.net/videos/Filmster_048_Video-2.mp4;https://filmster-stream.b-cdn.net/videos/Filmster_048_Video-3.mp4;qr_codes/Filmster_048_QR.png;;;;;;
049;Monsters, Inc.;2001;Pete Docter;John Goodman, Billy Crystal, Mary Gibbs, Steve Buscemi, James Coburn;Ja;8,1;Pixar;Animation, Komedie, Familie;$579,700,000;;https://www.youtube.com/watch?v=CGbgaHoapFM;filmster://result?id=049;https://filmster-stream.b-cdn.net/videos/Filmster_049_Video-1.mp4;https://filmster-stream.b-cdn.net/videos/Filmster_049_Video-2.mp4;https://filmster-stream.b-cdn.net/videos/Filmster_049_Video-3.mp4;qr_codes/Filmster_049_QR.png;;;;;;
050;Cars;2006;John Lasseter;Owen Wilson, Paul Newman, Bonnie Hunt, Larry the Cable Guy, Cheech Marin;Nein;7,3;Pixar;Animation, Abenteuer, Komedie, Familie;$461,983,149;;https://www.youtube.com/watch?v=W_H7_tDHFE8;filmster://result?id=050;https://filmster-stream.b-cdn.net/videos/Filmster_050_Video-1.mp4;https://filmster-stream.b-cdn.net/videos/Filmster_050_Video-2.mp4;https://filmster-stream.b-cdn.net/videos/Filmster_050_Video-3.mp4;qr_codes/Filmster_050_QR.png;;;;;;
051;Taxi Driver;1976;Martin Scorsese;Robert De Niro, Jodie Foster, Cybill Shepherd, Harvey Keitel, Peter Boyle;Ja;8,2;Italo/Judeo Productions;Krimi, Drama;$28,579,636;;https://www.youtube.com/watch?v=T5IligQP7Fo;filmster://result?id=051;https://filmster-stream.b-cdn.net/videos/Filmster_051_Video-1.mp4;https://filmster-stream.b-cdn.net/videos/Filmster_051_Video-2.mp4;https://filmster-stream.b-cdn.net/videos/Filmster_051_Video-3.mp4;qr_codes/Filmster_051_QR.png;;;;;;
052;Apocalypse Now;1979;Francis Ford Coppola;Martin Sheen, Marlon Brando, Frederic Forrest, Albert Hall, Laurence Fishburne;Ja;8,4;United Artists;Drama, Kriegsfilm;$150,000,000;;https://www.youtube.com/watch?v=FTjG-Aux_yQ;filmster://result?id=052;https://filmster-stream.b-cdn.net/videos/Filmster_052_Video-1.mp4;https://filmster-stream.b-cdn.net/videos/Filmster_052_Video-2.mp4;https://filmster-stream.b-cdn.net/videos/Filmster_052_Video-3.mp4;qr_codes/Filmster_052_QR.png;;;;;;
